{
  "$schema": "https://json-schema.org/draft/2020-12/schema",
  "$id": "https://schemas.gajae.local/prompt-contracts/imggen2-production-record/v1",
  "title": "ImgGen2 production record v1",
  "type": "object",
  "additionalProperties": false,
  "required": ["schema_version", "id", "full_prompt", "output_path", "reference_ids", "ar", "size", "quality", "output_format", "metadata"],
  "properties": {
    "schema_version": {"const": "imggen2-production-record/v1"},
    "id": {"type": "string", "pattern": "^[A-Za-z0-9][A-Za-z0-9._-]{0,127}$"},
    "full_prompt": {"type": "string", "minLength": 1, "maxLength": 2000},
    "output_path": {"type": "string", "pattern": "^[A-Za-z0-9][A-Za-z0-9._/-]*\\.png$", "maxLength": 500},
    "reference_ids": {"type": "array", "maxItems": 4, "items": {"type": "string", "pattern": "^[A-Za-z0-9][A-Za-z0-9_.:-]{2,127}$"}},
    "ar": {"type": "string", "enum": ["1:1", "3:4", "4:3", "9:16", "16:9"]},
    "size": {"type": "string", "enum": ["1024x1024", "1536x1024", "1024x1536"]},
    "quality": {"type": "string", "enum": ["low", "medium", "high"]},
    "output_format": {"const": "png"},
    "metadata": {
      "type": "object",
      "additionalProperties": false,
      "required": ["mpw_lineage", "compile_facts"],
      "properties": {
        "mpw_lineage": {
          "type": "object",
          "additionalProperties": false,
          "required": ["schema_version", "garden_recipe_id", "garden_recipe_sha256", "prompt_bundle_id", "prompt_bundle_sha256", "adapter_options_sha256", "compiler_version", "reference_digest"],
          "properties": {
            "schema_version": {"const": "mpw-lineage/v1"},
            "garden_recipe_id": {"type": "string", "pattern": "^gr_[A-Za-z0-9_-]{8,128}$"},
            "garden_recipe_sha256": {"$ref": "#/$defs/sha256"},
            "prompt_bundle_id": {"type": "string", "pattern": "^pb_[A-Za-z0-9_-]{8,128}$"},
            "prompt_bundle_sha256": {"$ref": "#/$defs/sha256"},
            "adapter_options_sha256": {"$ref": "#/$defs/sha256"},
            "compiler_version": {"type": "string", "pattern": "^[0-9]+\\.[0-9]+\\.[0-9]+$"},
            "reference_digest": {"$ref": "#/$defs/sha256"},
            "recompile": {
              "type": "object",
              "additionalProperties": false,
              "required": ["request_sha256", "prior_bundle_sha256", "prior_final_prompt_sha256", "retry_generation", "applied_delta_codes"],
              "properties": {
                "request_sha256": {"$ref": "#/$defs/sha256"},
                "prior_bundle_sha256": {"$ref": "#/$defs/sha256"},
                "prior_final_prompt_sha256": {"$ref": "#/$defs/sha256"},
                "retry_generation": {"type": "integer", "minimum": 1},
                "applied_delta_codes": {"type": "array", "minItems": 1, "items": {"type": "string"}}
              }
            }
          }
        },
        "compile_facts": {
          "type": "object",
          "additionalProperties": false,
          "required": ["promotional", "rendered_text_expected"],
          "properties": {
            "promotional": {"type": "boolean"},
            "rendered_text_expected": {"type": "boolean"}
          }
        }
      }
    }
  },
  "$defs": {"sha256": {"type": "string", "pattern": "^sha256:[0-9a-f]{64}$"}}
}
